{
  "name": "scene_transition",
  "description_pt": "Transição entre cenas com fade configurável. transition_to(scene_path, duration) aplica fade-out, troca a cena via change_scene_to_file, e faz fade-in. CanvasLayer garante sobrevivência.",
  "description_en": "Scene transition with configurable fade. transition_to(scene_path, duration) applies fade-out, changes scene via change_scene_to_file, and fades in. CanvasLayer ensures survival.",
  "synonyms": {
    "pt": ["transicao", "trocar_cena", "fade", "carregar", "mudar_scene"],
    "en": ["transition", "change_scene", "fade", "load", "switch"]
  },
  "parameters": [
    {"name": "fade_color", "type": "Color", "description_pt": "Cor do fade.", "default": {"r":0.0,"g":0.0,"b":0.0,"a":1.0}},
    {"name": "default_duration", "type": "float", "description_pt": "Duração total (fade-out + fade-in).", "range": {"min": 0.1, "max": 5.0}, "default": 0.5, "unit": "s"}
  ],
  "signals": [
    {"name": "transition_started", "description_pt": "Emitido ao iniciar o fade-out.", "params": []},
    {"name": "transition_finished", "description_pt": "Emitido após fade-in na nova cena.", "params": []}
  ],
  "dependencies": [],
  "genres": ["generic"],
  "conflicts": [],
  "version": "1.0.0",
  "godot_version": "4.7",
  "tags": ["sistema", "transicao", "cena", "fade"]
}
