{
  "name": "modular_weapon",
  "version": "1.0.0",
  "godot_version": "4.7",
  "description_pt": "Behavior modular_weapon para Godot 4.7.",
  "description_en": "modular_weapon behavior for Godot 4.7.",
  "synonyms": {
    "pt": [
      "modular_weapon"
    ],
    "en": [
      "modular_weapon"
    ]
  },
  "parameters": [],
  "signals": [],
  "genres": [
    "generic"
  ],
  "conflicts": [],
  "tags": []
}